{
  "schema": "nekkora-studio/guided-debug-record",
  "version": "1.0.0",
  "automationId": "774defa5-103d-4b24-bc30-bdc50611a35d",
  "planSchema": "nekkora-studio/guided-debug-plan/1.0.0",
  "planRevision": "sha256:c9341d1aa23cb39337c5bd53d05683a9cae33239d124fe4650942c1c04aab42c",
  "operator": "TEST_AGENT",
  "exportedAt": "2026-10-17T19:10:03.636773600Z",
  "meaning": "NO_EXECUTION_NO_BUSINESS_OUTCOME",
  "entries": [
    {
      "stepId": "a1abe836-28d7-484a-9665-4ceea4ef7383",
      "at": "2026-10-17T19:09:27.752Z",
      "kind": "VERIFICATION",
      "status": "RESOLVED",
      "identitySource": "TARGET_ID",
      "reasons": ["NODE_REPLACED"],
      "outcome": "NO_DECISION",
      "outcomeReasons": [],
      "actor": "TEST_AGENT"
    },
    {
      "stepId": "a1abe836-28d7-484a-9665-4ceea4ef7383",
      "at": "2026-10-17T19:09:28.311847500Z",
      "kind": "DECISION",
      "status": "CONFIRMED",
      "identitySource": "TARGET_ID",
      "reasons": ["NODE_REPLACED"],
      "outcome": "",
      "outcomeReasons": [],
      "actor": "TEST_AGENT"
    },
    {
      "stepId": "a44a73a5-7733-4745-8140-7442cde06414",
      "at": "2026-10-17T19:09:28.326Z",
      "kind": "VERIFICATION",
      "status": "RESOLVED",
      "identitySource": "TARGET_ID",
      "reasons": ["NODE_REPLACED"],
      "outcome": "NO_DECISION",
      "outcomeReasons": [],
      "actor": "TEST_AGENT"
    },
    {
      "stepId": "a44a73a5-7733-4745-8140-7442cde06414",
      "at": "2026-10-17T19:09:28.884006100Z",
      "kind": "DECISION",
      "status": "CONFIRMED",
      "identitySource": "TARGET_ID",
      "reasons": ["NODE_REPLACED"],
      "outcome": "",
      "outcomeReasons": [],
      "actor": "TEST_AGENT"
    },
    {
      "stepId": "a1abe836-28d7-484a-9665-4ceea4ef7383",
      "at": "2026-10-17T19:09:47.254Z",
      "kind": "VERIFICATION",
      "status": "RESOLVED",
      "identitySource": "TARGET_ID",
      "reasons": ["NODE_REPLACED", "ID_ATTRIBUTE_CHANGED", "NAME_ATTRIBUTE_CHANGED"],
      "outcome": "REVIEW",
      "outcomeReasons": ["ATTRIBUTES_CHANGED"],
      "actor": "TEST_AGENT"
    },
    {
      "stepId": "a1abe836-28d7-484a-9665-4ceea4ef7383",
      "at": "2026-10-17T19:09:48.299945300Z",
      "kind": "DECISION",
      "status": "REJECTED",
      "identitySource": "TARGET_ID",
      "reasons": ["NODE_REPLACED", "ID_ATTRIBUTE_CHANGED", "NAME_ATTRIBUTE_CHANGED"],
      "outcome": "",
      "outcomeReasons": [],
      "actor": "TEST_AGENT"
    },
    {
      "stepId": "a1abe836-28d7-484a-9665-4ceea4ef7383",
      "at": "2026-10-17T19:09:50.745988500Z",
      "kind": "CORRECTION",
      "status": "SELECTED_IN_BROWSER",
      "identitySource": "TARGET_ID",
      "reasons": [],
      "outcome": "",
      "outcomeReasons": [],
      "actor": "TEST_AGENT"
    },
    {
      "stepId": "a1abe836-28d7-484a-9665-4ceea4ef7383",
      "at": "2026-10-17T19:09:50.759Z",
      "kind": "VERIFICATION",
      "status": "RESOLVED",
      "identitySource": "TARGET_ID",
      "reasons": [],
      "outcome": "REUSE",
      "outcomeReasons": [],
      "actor": "TEST_AGENT"
    },
    {
      "stepId": "a44a73a5-7733-4745-8140-7442cde06414",
      "at": "2026-10-17T19:09:51.991Z",
      "kind": "VERIFICATION",
      "status": "NOT_FOUND",
      "identitySource": "TARGET_ID",
      "reasons": [],
      "outcome": "REVIEW",
      "outcomeReasons": ["IDENTITY_NOT_RESOLVED", "STATE_NOT_SUITABLE"],
      "actor": "TEST_AGENT"
    },
    {
      "stepId": "a44a73a5-7733-4745-8140-7442cde06414",
      "at": "2026-10-17T19:09:52.732327400Z",
      "kind": "DECISION",
      "status": "REJECTED",
      "identitySource": "TARGET_ID",
      "reasons": [],
      "outcome": "",
      "outcomeReasons": [],
      "actor": "TEST_AGENT"
    },
    {
      "stepId": "a44a73a5-7733-4745-8140-7442cde06414",
      "at": "2026-10-17T19:09:55.131375400Z",
      "kind": "CORRECTION",
      "status": "SELECTED_IN_BROWSER",
      "identitySource": "TARGET_ID",
      "reasons": [],
      "outcome": "",
      "outcomeReasons": [],
      "actor": "TEST_AGENT"
    },
    {
      "stepId": "a44a73a5-7733-4745-8140-7442cde06414",
      "at": "2026-10-17T19:09:55.144Z",
      "kind": "VERIFICATION",
      "status": "RESOLVED",
      "identitySource": "TARGET_ID",
      "reasons": [],
      "outcome": "REUSE",
      "outcomeReasons": [],
      "actor": "TEST_AGENT"
    },
    {
      "stepId": "a1abe836-28d7-484a-9665-4ceea4ef7383",
      "at": "2026-10-17T19:09:59.791Z",
      "kind": "VERIFICATION",
      "status": "RESOLVED",
      "identitySource": "TARGET_ID",
      "reasons": ["NODE_REPLACED"],
      "outcome": "REUSE",
      "outcomeReasons": [],
      "actor": "TEST_AGENT"
    },
    {
      "stepId": "a44a73a5-7733-4745-8140-7442cde06414",
      "at": "2026-10-17T19:10:01.018Z",
      "kind": "VERIFICATION",
      "status": "RESOLVED",
      "identitySource": "TARGET_ID",
      "reasons": ["NODE_REPLACED"],
      "outcome": "REUSE",
      "outcomeReasons": [],
      "actor": "TEST_AGENT"
    }
  ],
  "finalDecisions": [
    {
      "stepId": "a1abe836-28d7-484a-9665-4ceea4ef7383",
      "decision": "CONFIRMED",
      "actor": "TEST_AGENT",
      "basisStatus": "SELECTED_IN_BROWSER",
      "targetReplaced": true
    },
    {
      "stepId": "a44a73a5-7733-4745-8140-7442cde06414",
      "decision": "CONFIRMED",
      "actor": "TEST_AGENT",
      "basisStatus": "SELECTED_IN_BROWSER",
      "targetReplaced": true
    }
  ],
  "summary": {
    "entries": 14,
    "confirmed": 2,
    "rejected": 0,
    "undecided": 0,
    "reused": 4,
    "probesPerformed": 0
  },
  "exclusions": ["VALUES", "NAMES_AND_DESCRIPTIONS", "PAGE_TEXT", "RESOLVER_STATEMENTS", "CORRELATION_KEYS", "BUSINESS_OUTCOME"]
}
