{
  "schema": "nekkora-studio/guided-debug-record",
  "version": "1.0.0",
  "automationId": "00000000-0000-4000-8000-000000000001",
  "planSchema": "nekkora-studio/guided-debug-plan/1.0.0",
  "planRevision": "sha256:0000000000000000000000000000000000000000000000000000000000000000",
  "operator": "TEST_AGENT",
  "exportedAt": "2026-10-17T12:10:00Z",
  "meaning": "NO_EXECUTION_NO_BUSINESS_OUTCOME",
  "entries": [
    {
      "stepId": "00000000-0000-4000-8000-000000000002",
      "at": "2026-10-17T12:00:05Z",
      "kind": "VERIFICATION",
      "status": "RESOLVED",
      "identitySource": "TARGET_ID",
      "reasons": [],
      "outcome": "NO_DECISION",
      "outcomeReasons": [],
      "actor": "TEST_AGENT"
    },
    {
      "stepId": "00000000-0000-4000-8000-000000000002",
      "at": "2026-10-17T12:00:05Z",
      "kind": "DECISION",
      "status": "CONFIRMED",
      "identitySource": "TARGET_ID",
      "reasons": [],
      "outcome": "",
      "outcomeReasons": [],
      "actor": "TEST_AGENT"
    },
    {
      "stepId": "00000000-0000-4000-8000-000000000003",
      "at": "2026-10-17T12:00:05Z",
      "kind": "VERIFICATION",
      "status": "AMBIGUOUS",
      "identitySource": "DESCRIPTOR",
      "reasons": ["DESCRIPTOR_ONLY", "TARGET_AMBIGUOUS"],
      "outcome": "NO_DECISION",
      "outcomeReasons": [],
      "actor": "TEST_AGENT"
    },
    {
      "stepId": "00000000-0000-4000-8000-000000000003",
      "at": "2026-10-17T12:00:05Z",
      "kind": "PROBE",
      "status": "RESOLVED",
      "identitySource": "",
      "reasons": [],
      "outcome": "PERFORMED",
      "outcomeReasons": [],
      "actor": "TEST_AGENT"
    }
  ],
  "finalDecisions": [
    {
      "stepId": "00000000-0000-4000-8000-000000000002",
      "decision": "CONFIRMED",
      "actor": "TEST_AGENT",
      "basisStatus": "RESOLVED",
      "targetReplaced": false
    },
    {
      "stepId": "00000000-0000-4000-8000-000000000003",
      "decision": null,
      "actor": null,
      "basisStatus": null,
      "targetReplaced": false
    },
    {
      "stepId": "00000000-0000-4000-8000-000000000004",
      "decision": null,
      "actor": null,
      "basisStatus": null,
      "targetReplaced": false
    }
  ],
  "summary": {
    "entries": 4,
    "confirmed": 1,
    "rejected": 0,
    "undecided": 2,
    "reused": 0,
    "probesPerformed": 1
  },
  "exclusions": ["VALUES", "NAMES_AND_DESCRIPTIONS", "PAGE_TEXT", "RESOLVER_STATEMENTS", "CORRELATION_KEYS", "BUSINESS_OUTCOME"]
}
