{
  "schema": "nekkora-studio/guided-debug-record",
  "version": "1.0.0",
  "automationId": "774defa5-103d-4b24-bc30-bdc50611a35d",
  "planSchema": "nekkora-studio/guided-debug-plan/1.0.0",
  "planRevision": "sha256:d4ea85f50f5eb690e91f88dab48ff70b5b22b28d461a45a243a0880c2e89c4ce",
  "operator": "TEST_AGENT",
  "exportedAt": "2026-10-17T19:09:30.530853700Z",
  "meaning": "NO_EXECUTION_NO_BUSINESS_OUTCOME",
  "entries": [
    {
      "stepId": "a1abe836-28d7-484a-9665-4ceea4ef7383",
      "at": "2026-10-17T19:09:27.752Z",
      "kind": "VERIFICATION",
      "status": "RESOLVED",
      "identitySource": "TARGET_ID",
      "reasons": ["NODE_REPLACED"],
      "outcome": "NO_DECISION",
      "outcomeReasons": [],
      "actor": "TEST_AGENT"
    },
    {
      "stepId": "a1abe836-28d7-484a-9665-4ceea4ef7383",
      "at": "2026-10-17T19:09:28.311847500Z",
      "kind": "DECISION",
      "status": "CONFIRMED",
      "identitySource": "TARGET_ID",
      "reasons": ["NODE_REPLACED"],
      "outcome": "",
      "outcomeReasons": [],
      "actor": "TEST_AGENT"
    },
    {
      "stepId": "a44a73a5-7733-4745-8140-7442cde06414",
      "at": "2026-10-17T19:09:28.326Z",
      "kind": "VERIFICATION",
      "status": "RESOLVED",
      "identitySource": "TARGET_ID",
      "reasons": ["NODE_REPLACED"],
      "outcome": "NO_DECISION",
      "outcomeReasons": [],
      "actor": "TEST_AGENT"
    },
    {
      "stepId": "a44a73a5-7733-4745-8140-7442cde06414",
      "at": "2026-10-17T19:09:28.884006100Z",
      "kind": "DECISION",
      "status": "CONFIRMED",
      "identitySource": "TARGET_ID",
      "reasons": ["NODE_REPLACED"],
      "outcome": "",
      "outcomeReasons": [],
      "actor": "TEST_AGENT"
    }
  ],
  "finalDecisions": [
    {
      "stepId": "a1abe836-28d7-484a-9665-4ceea4ef7383",
      "decision": "CONFIRMED",
      "actor": "TEST_AGENT",
      "basisStatus": "RESOLVED",
      "targetReplaced": false
    },
    {
      "stepId": "a44a73a5-7733-4745-8140-7442cde06414",
      "decision": "CONFIRMED",
      "actor": "TEST_AGENT",
      "basisStatus": "RESOLVED",
      "targetReplaced": false
    }
  ],
  "summary": {
    "entries": 4,
    "confirmed": 2,
    "rejected": 0,
    "undecided": 0,
    "reused": 0,
    "probesPerformed": 0
  },
  "exclusions": ["VALUES", "NAMES_AND_DESCRIPTIONS", "PAGE_TEXT", "RESOLVER_STATEMENTS", "CORRELATION_KEYS", "BUSINESS_OUTCOME"]
}
